{
  "schema_version": "synora.cognitive.event-frame/v1",
  "envelope": {"provenance":"simulated_test","availability":"unavailable","quality":0,"logical_timestamp":"2026-01-01T00:00:00Z"},
  "security": {"armed":false,"degraded":false,"alarm_state":"unknown","constraints":["dry_run_only","no_audio","no_physical_action","fail_closed"]},
  "presence": {"human":"unknown","animal":"unknown","vehicle":"unknown","unknown":true},
  "topology": {"zone_type":"unknown","environment":"unknown","boundary":"unknown","restriction":"unknown","relation":"unknown"},
  "evidence": {"vision_availability":"unavailable","pose_availability":"unavailable","face_availability":"not_requested","sensor_state":"unavailable","access_state":"unknown","motion_state":"still","camera_health":"unknown","enrichment_state":"unavailable"},
  "co_evidence": {"concurrent_facts":0,"independent_sources":0,"contradictions":0,"sufficiency":"unknown"}
}
